Implement, GivenName, LastName, Initials, StreetAddress, City, PostalCode, State, Country, EMail, Phone, PhoneIPPrimary, PhoneIPOther, Company, Department, OfficeName, EmployeeID, Title, Manager, BuildingName, ProfilePath, ScriptPath, HomeDirectory, HomeDrive, Password, PasswordNeverExpires, BadPasswordTimeout, BadPasswordCount, MaxPwdAge, LastLogon, TargetOU, ProxyAddress, Enabled, Description, BirthLocation, Drink, JpegPhoto, WWWHomePage, ObjectGUID, AdditionalInfo


Yes, Joseph, Bowers, B., 2443 Leroy Lane, Owingsville, 40360, KY, United States, JosephBBowers@armyspy.com            , 1 606-210-4939, , , Titania, Cooling and freezing equipment tender, , , , , , \profile\path, \script\path, \home\dir, H:, ahgh3ceD8, False, , 0, , , OU=Users; OU=Lab, SMTP:CHECK; SMTP:CHECK2, True, , , , , chadathainc.com, 6d9b695c-157c-4791-acc2-2c19f0119baa, Mother's maiden name: Morman; SSN: 405-09-2124; Birthday: March 12  1931; Credit Card: Visa 4556 6348 8299 8251 Expires: 4/2020: CVV2: 925; Height: 5' 9" (174 centimeters); Weight: 168.3 pounds (76.5 kilograms); Blood type: B+; Favorite color: Blue; Vehicle: 2004 Ford Econoline; 
Yes, Donna, Phillips, M., 3190 Foley Street, Hollywood, 33024, FL, United States, DonnaMPhillips@armyspy.com            , 1 954-680-1189, , , Evans, Aerobics instructor, , , , , , \profile\path, \script\path, \home\dir, H:, jeinge7Qu, False, , 8, , , OU=Users; OU=Lab, SMTP:CHECK; SMTP:CHECK2, True, , , , , beuniformedical.com, a97f4527-a6ac-4901-a2c7-6de7f5b737d4, Mother's maiden name: Clapp; SSN: 766-34-7360; Birthday: August 21  1945; Credit Card: Visa 4929 1163 1127 1799 Expires: 5/2018: CVV2: 746; Height: 5' 5" (166 centimeters); Weight: 176.7 pounds (80.3 kilograms); Blood type: A+; Favorite color: Purple; Vehicle: 2000 Ford Escape; 
Yes, Stephanie, Shepherd, R., 370 Sarah Drive, Leesville, 71446, LA, United States, StephanieRShepherd@rhyta.com            , 1 337-535-0600, , , Buehler Foods, Tax collector, , , , , , \profile\path, \script\path, \home\dir, H:, Tie9phooz, False, , 2, , , OU=Users; OU=Lab, SMTP:CHECK; SMTP:CHECK2, True, , , , , ailuroidea.com, a42d648d-97c2-4116-a8d2-7cf95a9a16a7, Mother's maiden name: Barnes; SSN: 433-82-4482; Birthday: March 12  1977; Credit Card: Visa 4532 3116 3432 0519 Expires: 8/2019: CVV2: 241; Height: 5' 5" (164 centimeters); Weight: 176.4 pounds (80.2 kilograms); Blood type: A+; Favorite color: Red; Vehicle: 2001 Citroen Berlingo; 
Yes, Jimmy, Bissette, Y., 1934 Peaceful Lane, Cleveland, 44103, OH, United States, JimmyYBissette@armyspy.com            , 1 216-432-8285, , , Nobil, Wait staff, , , , , , \profile\path, \script\path, \home\dir, H:, da6haeha4Ei, False, , 2, , , OU=Users; OU=Lab, SMTP:CHECK; SMTP:CHECK2, True, , , , , brontidea.com, f241904f-5e74-4f89-8788-7fc33f12d7a6, Mother's maiden name: Ramos; SSN: 271-04-2801; Birthday: July 27  1962; Credit Card: MasterCard 5127 3156 4782 3276 Expires: 6/2018: CVC2: 511; Height: 5' 9" (175 centimeters); Weight: 148.7 pounds (67.6 kilograms); Blood type: A+; Favorite color: Purple; Vehicle: 1999 AC Ace; 
Yes, Frances, Yuen, S., 717 Sunny Glen Lane, Cleveland, 44115, OH, United States, FrancesSYuen@dayrep.com            , 1 216-737-1234, , , Patterson-Fletcher, LAN manager, , , , , , \profile\path, \script\path, \home\dir, H:, chai5eaTae, False, , 1, , , OU=Users; OU=Lab, SMTP:CHECK; SMTP:CHECK2, True, , , , , azoimidea.com, 85518ae3-c830-4b31-9743-776abf24279e, Mother's maiden name: Robinson; SSN: 296-30-5143; Birthday: April 22  1936; Credit Card: MasterCard 5472 6416 6495 0911 Expires: 5/2021: CVC2: 734; Height: 5' 4" (162 centimeters); Weight: 130.5 pounds (59.3 kilograms); Blood type: O+; Favorite color: Blue; Vehicle: 2008 Citroen Picasso; 
